{
  "$schema": "https://json-schema.org/draft/2020-12/schema",
  "$id": "https://noderamc.org/schema/service-index-1.json",
  "title": "Nodera service index",
  "description": "A list of trackers and rendezvous services. This is the format of the project's own list (index.json on this branch) AND of any third-party store a user adds in the app — deliberately one format, so a store is not a second-class citizen and the built-in list is not a special case. An index is a set of HINTS: every service in it still proves who it is with its own Ed25519 signature, and nothing here grants any authority over world state.",
  "type": "object",
  "additionalProperties": false,
  "required": ["schema_version", "name", "services"],
  "properties": {
    "schema_version": {
      "description": "1. Bumped only for a breaking change; a reader that does not know the version must refuse the index rather than guess at it.",
      "type": "integer",
      "const": 1
    },
    "name": {
      "description": "What to call this store in a list of stores.",
      "type": "string",
      "minLength": 1,
      "maxLength": 64
    },
    "description": {
      "type": "string",
      "maxLength": 512
    },
    "homepage": {
      "type": "string",
      "format": "uri",
      "pattern": "^https://"
    },
    "updated": {
      "description": "ISO date this index last changed. Informational — freshness that matters is measured, not declared.",
      "type": "string",
      "pattern": "^[0-9]{4}-[0-9]{2}-[0-9]{2}$"
    },
    "services": {
      "type": "array",
      "maxItems": 256,
      "items": { "$ref": "#/$defs/service" }
    }
  },
  "$defs": {
    "service": {
      "type": "object",
      "additionalProperties": false,
      "required": ["kind", "name", "endpoints"],
      "properties": {
        "kind": {
          "description": "tracker = discovery. rendezvous = reachability behind NAT. A host running both publishes two entries: they are separate services on separate ports with separate identities.",
          "type": "string",
          "enum": ["tracker", "rendezvous"]
        },
        "name": {
          "type": "string",
          "minLength": 1,
          "maxLength": 64
        },
        "endpoints": {
          "description": "Routes to try, best first. More than one is normal and useful: a name plus a literal address survives a DNS outage, and an IPv4 plus an IPv6 route survives a client with only one of them.",
          "type": "array",
          "minItems": 1,
          "maxItems": 8,
          "items": {
            "type": "string",
            "pattern": "^(tcp|udp)://[A-Za-z0-9._:\\[\\]-]+:[0-9]{1,5}$"
          }
        },
        "node_id": {
          "description": "The service's stable identity, 32 lowercase hex characters, if the operator has published it. Optional, and its absence is normal — a peer that has never seen this service trusts it on first use either way. When present it turns a hijacked DNS name from something a peer accepts into something a peer notices.",
          "type": "string",
          "pattern": "^[0-9a-f]{32}$"
        },
        "operator": {
          "description": "Who runs it. A contact, not an authority.",
          "type": "string",
          "maxLength": 64
        },
        "region": {
          "description": "Rough location, so a peer far from every listed service can see that rather than infer it from latency.",
          "type": "string",
          "maxLength": 32
        },
        "notes": {
          "description": "Free text from the operator, shown to a user who opens the entry in the app.",
          "type": "string",
          "maxLength": 256
        }
      }
    }
  }
}
